{"$schema":"https://json-schema.org/draft/2020-12/schema","title":"Mightora roadmap","type":"object","required":["schemaVersion","title","client","startDate","periodCount","tracks","activities"],"properties":{"schemaVersion":{"const":1},"title":{"type":"string","minLength":1,"maxLength":120},"client":{"type":"string","minLength":1,"maxLength":120},"startDate":{"type":"string","format":"date"},"periodCount":{"type":"integer","minimum":4,"maximum":12},"quarterLabels":{"type":"array","minItems":4,"maxItems":12,"items":{"type":"string","minLength":1,"maxLength":80}},"tracks":{"type":"array","minItems":1,"maxItems":20,"items":{"type":"object","required":["id","name","color"],"properties":{"id":{"type":"string","minLength":1,"maxLength":80},"name":{"type":"string","minLength":1,"maxLength":80},"color":{"type":"string","pattern":"^#[0-9a-fA-F]{6}$"}}}},"activities":{"type":"array","items":{"type":"object","required":["id","title","trackId","start","end","status","owner","description","dependencies"],"properties":{"id":{"type":"string","minLength":1,"maxLength":80},"title":{"type":"string","minLength":1,"maxLength":160},"trackId":{"type":"string"},"start":{"type":"string","format":"date"},"end":{"type":"string","format":"date"},"status":{"enum":["Planned","In progress","Done","On hold"]},"owner":{"type":"string","maxLength":100},"description":{"type":"string","maxLength":8000},"dependencies":{"type":"array","uniqueItems":true,"items":{"type":"string"}}}}}},"description":"Structural schema only. Runtime validation also checks unique IDs, reference integrity, quarter label count, date horizon, cycles and prerequisite readiness."}
